{
    "maxNumMissingSamples": 3,
    "current_phase": "production",
    "service": true,
    "production_sessions": 5000,
    "development_sessions": 500,
    "evaluation_sessions": 50,
    "ip_preparation": "127.0.0.1",
    "ip_evaluation": "172.20.10.2",
    "port_preparation": 5002,
    "port_evaluation": 5210,
    "ip_ingestion": "0.0.0.0",
    "port_ingestion": 5001
}